ticker,date,time,headline
fb,Jan-04-19,06:22PM,"Facebook, Apple, Netflix, Amazon and Alphabet Power Friday Gains"
fb,Jan-04-19,05:15PM,"Earnings Reports for the Week of Jan. 7-11 (BBBY, KBH)"
fb,Jan-04-19,04:55PM,COLUMN-Commentary: 2019 will be the year of more state control
fb,Jan-04-19,04:53PM,3 Tech Trends to Watch in 2019
fb,Jan-04-19,04:30PM,Will Denver's tech growth continue in 2019?
fb,Jan-04-19,02:46PM,Facebook to Prioritize Video in 2019
fb,Jan-04-19,01:52PM,ScotteVest CEO: How a Facebook Passion Project Evolved into a New Business
fb,Jan-04-19,01:47PM,"Millennials Load Up on Battered Apple, Facebook, GE"
fb,Jan-04-19,01:00PM,FAANGs See a Weak Start to 2019: More Pain Ahead for ETFs?
fb,Jan-04-19,12:18PM,U[PDATE: Netflix shares soar 9% as Goldman adds stock to its Conviction List
fb,Jan-04-19,12:11PM,What Strategy Should Stock Pickers Use in 2019?
fb,Jan-04-19,11:54AM,7 Tech Stocks Without China Exposure
fb,Jan-04-19,11:08AM,Amazon (AMZN) Faces Strike Hurdles Before Epiphany in Spain
fb,Jan-04-19,10:16AM,Apples stock price wont recover and 9 more bold predictions for 2019
fb,Jan-04-19,10:06AM,Facebook Earnings: Mark Your Calendar
fb,Jan-04-19,10:03AM,RBC's Mahaney: Tech 'Reckoning' Already Occurred
fb,Jan-04-19,09:28AM,Mark Zuckerberg hits pause on his plan to sell billions of dollars worth of Facebook stock
fb,Jan-04-19,08:35AM,Social Media ETF Stung By Analyst Downgrades
fb,Jan-04-19,08:33AM,Twitter Still Vulnerable to Hacking by Terrorist Groups
fb,Jan-04-19,06:00AM,Apple vs. Facebook. Whos Had the Worse Run?
fb,Jan-04-19,05:26AM,Facebook Rises 3%
fb,Jan-03-19,10:59PM,[$$] Facebook Begins New Year in Fixer-Upper Mode
fb,Jan-03-19,05:45PM,Investors Are Focused Too Closely on Facebook and Google's Market Share
fb,Jan-03-19,05:32PM,[$$] Facebook Begins New Year in Fixer-Upper Mode
fb,Jan-03-19,05:24PM,Facebook (FB) Reportedly Testing Dark Mode on Messenger
fb,Jan-03-19,04:10PM,"Google Stock Upgraded, Viewed As 'Most Defensive' FANG Amid Tech Sell-Off"
fb,Jan-03-19,03:26PM,Is Facebook Stock the Best FANG Stock to Buy?
fb,Jan-03-19,03:14PM,"Zuckerberg Paused His Selling of Facebook Shares, Analysts Say It's a Good Sign"
fb,Jan-03-19,01:36PM,What's Next For Apple (AAPL) After It Slashed Its Q1 Sales Forecast?
fb,Jan-03-19,01:31PM,Take the Money And Run From Twilio Stock
fb,Jan-03-19,12:25PM,3 Great Reasons You Should Be Bullish on Twilio Stock
fb,Jan-03-19,10:42AM,Why Netflix Stock Will Rise Back Above $300 In 2019
fb,Jan-03-19,10:21AM,Facebook Under Fire for Collecting Data From Android Apps
fb,Jan-03-19,10:08AM,Mark Zuckerberg Halts Stock Sales as Facebook Shares Tumble
fb,Jan-03-19,09:58AM,Facebook Falls 3%
fb,Jan-03-19,09:48AM,"Stock Market News For Jan 3, 2019"
fb,Jan-03-19,09:34AM,Apple warning stoking fears of slowdown in Chinese econom...
fb,Jan-03-19,09:12AM,Why The FAANGs Are Crucial To A 2019 Market Rally
fb,Jan-03-19,09:07AM,"The Zacks Analyst Blog Highlights: Facebook, Wells Fargo, AT&T, Intel and Glaxo"
fb,Jan-03-19,08:04AM,"3 Big Stock Charts for Thursday: Medtronic, Facebook and eBay"
fb,Jan-03-19,06:00AM,Why Internet Censorship Doesnt Work and Never Will
fb,Jan-02-19,10:35PM,Technology Stocks: Should You Bail?
fb,Jan-02-19,06:46PM,Here's Why Facebook (FB) Stock Looks Like a Buy
fb,Jan-02-19,05:16PM,New Guru Philippe Laffont's Top 5 Holdings
fb,Jan-02-19,04:14PM,Should Mark Zuckerberg step away from Facebook?
fb,Jan-02-19,04:05PM,Facebook to Announce Fourth Quarter and Full Year 2018 Results
fb,Jan-02-19,02:25PM,Mighty FAANG Stocks No Longer A Sure Bet For 2019 Stock Year
fb,Jan-02-19,02:15PM,This Chart Implies That Google Stock Is Due for a 20% Rally
fb,Jan-02-19,01:36PM,Will Insiders Be Buying Stocks in 2019?
fb,Jan-02-19,12:10PM,Stock Market News: Nasdaq Pares 1.9% Intraday Loss As Chip Stocks Lead
fb,Jan-02-19,11:01AM,3 Reasons Why Google Stock Is a FANG You Can Trust
fb,Jan-02-19,10:16AM,Netflix Stocks Bull Case Looks Even Stronger
fb,Jan-02-19,10:12AM,"Warren Buffett Stocks: Who Joins Nvidia, Alibaba, Facebook On This Screen?"
fb,Jan-02-19,09:53AM,"Apple, Amazon sell-off overdone, research analyst says"
fb,Jan-02-19,09:38AM,Stocks Dive As China Tariffs Bite; Dow Jones Drops 350 Points
fb,Jan-02-19,09:30AM,3 Reasons Why I Bought Stocks on Monday
fb,Jan-02-19,08:53AM,Oversold Facebook Stock Set for Big Bounce
fb,Jan-02-19,08:27AM,Top 5 ROE Stocks to Invest in Now to Beat Market Blues
fb,Jan-02-19,08:13AM,[$$] Cyber Daily: CEOs Must Step Up
fb,Jan-02-19,07:51AM,Facebook Messenger tests Dark Mode to put less strain on users' eyes
fb,Jan-02-19,07:09AM,"During the Holidays, Unfriend Irksome Relatives at Your Own Risk"
fb,Jan-02-19,06:12AM,Facebook Rises 3%
fb,Jan-01-19,10:48PM,Google wins U.S. approval for radar-based hand motion sensor
fb,Jan-01-19,09:21AM,20 Realistic Tech Predictions for 2019 -- Part Two
fb,Jan-01-19,12:00AM,2018: A Year in Review for a Roller-Coaster Market
fb,Dec-31-18,05:51PM,Facebooks Mark Zuckerberg lost $22 billion in 2018: Report
fb,Dec-31-18,04:01PM,Facebook's worst year ever is now over. Here's how its scandals affected the stock
fb,Dec-31-18,04:01PM,A year ago the FAANG stocks were a hot buy  here's where they stand heading into 2019
fb,Dec-31-18,02:53PM,Netflix Rises as 2018 FAANG Leader Closes Out Year With a Rally
fb,Dec-31-18,01:59PM,"Facebook Falls Midday, Bringing Communication Services Index Down"
fb,Dec-31-18,11:41AM,Expert: It's likely the US will see a data privacy law in...
fb,Dec-31-18,11:34AM,Tech had a rocky 2018. Here's what 2019 might look like.
fb,Dec-31-18,11:16AM,Recode's Kara Swisher lays out 2019 tech predictions
fb,Dec-31-18,10:35AM,Why the Worst May Be Over for Tencent Stock
fb,Dec-31-18,10:31AM,Facebook Stock Finally Has Found the Bottom and Will Build a Great 2019
fb,Dec-31-18,10:23AM,"Venture investing in 2018: Seed deals, Saudis, scooters and more"
fb,Dec-31-18,09:04AM,Twitter Accounts Get Hacked for Demo to Reveal Security Gaps
fb,Dec-31-18,08:00AM,Better Buy: Facebook vs. Twitter
fb,Dec-31-18,07:30AM,Maxim analyst expects tech rally in 2019
fb,Dec-31-18,07:06AM,Android apps sharing data with Facebook without users' consent: Report
fb,Dec-30-18,08:00PM,It Looks Like Verizon's Online Advertising Project Is a Flop
fb,Dec-30-18,05:45PM,Did Facebook Just Become the Best Way to Invest in Blockchain?
fb,Dec-30-18,04:30PM,Facebook Chases Square Into the Peer-to-Peer Crypto Market
fb,Dec-30-18,03:39PM,"Benzinga's Bulls & Bears Of The Week: Amazon, Apple, Disney, Facebook, GM And More"
fb,Dec-30-18,03:23PM,Think Snap Is a Bargain? Think Again.
fb,Dec-30-18,02:10PM,A look back at the most read Bay Area business news of 2018
fb,Dec-29-18,07:00PM,Half a Billion Millennial Voters Are Face of Asia 2019
fb,Dec-29-18,04:43PM,"Tech Stocks This Week: Amazon's Big Holiday, A Bullish Call on Facebook, and More"
fb,Dec-29-18,07:00AM,Facebook has been thinking about moderation all wrong
fb,Dec-28-18,10:58PM,Year in Review 3: Reckless Predictions and Stocks to Watch in 2019
fb,Dec-28-18,05:50PM,Facebook (FB) Struggles to Regulate Content on Its Platform
fb,Dec-28-18,04:34PM,Facebook might need to undergo 'fundamental change' in or...
fb,Dec-28-18,04:13PM,"Markets End Tumultuous Day in the Red, Mini-Rally Ends at 2 Sessions"
fb,Dec-28-18,04:09PM,Regaining Trust Is the No. 1 Issue for Tech in 2019
fb,Dec-28-18,03:17PM,Facebook under fire over secret rulebook
fb,Dec-28-18,02:57PM,Accidental Instagram Update of Horizontal Scrolling Causes Uproar
fb,Dec-28-18,02:44PM,Zuckerberg Claims Facebook Has 'Fundamentally Altered' Its DNA
fb,Dec-28-18,01:46PM,Facebook CEO Zuckerberg Says Problems Will Take Years to Fix
fb,Dec-28-18,01:30PM,Zuckerberg: Facebook can never fully stop use of platform for election meddling
fb,Dec-28-18,11:35AM,Why Investors Should Avoid Snap Stock
fb,Sep-22-18,11:08AM,How former Facebook and Google engineer Bret Taylor earned Marc Benioff's trust at Salesforce
fb,Sep-22-18,12:02AM,"White House Drafts Order To Look Into Google, Facebook Practices"
fb,Sep-21-18,06:21PM,Facebook Withdraws Direct Promotion of Political Campaigns
fb,Sep-21-18,06:18PM,Facebook's Plan to Pull Back Campaign Support to Trump in 2020
fb,Sep-21-18,06:17PM,Facebook's Plan to Pull Back Campaign Support to Trump in 2020
fb,Sep-21-18,06:10PM,Does F.A.N.G. still stand? 8 trades
fb,Sep-21-18,05:28PM,"As stocks hit all-time highs, the F.A.N.G. trade is left ..."
fb,Sep-21-18,05:21PM,Its time for companies to end the obsession with millennials and hire older workers with skills and expertise
fb,Sep-21-18,04:04PM,"Earnings Reports for the Week of Sept. 24-28 (KBH, NKE, RAD)"
fb,Sep-21-18,04:03PM,Dow marks 2nd all-time high in a row but tech stocks weigh on broader market
fb,Sep-21-18,03:36PM,Facebook Could Unveil Its Video-Chatting Device Next Week
fb,Sep-21-18,01:50PM,Facebook Rolls Out New Dating Service With Unique Spin
fb,Sep-21-18,12:33PM,Facebook Prices Could Trade Sideways From Here
fb,Sep-21-18,11:45AM,Theres Lots to Like About Alphabet Stock in the Long Run
fb,Sep-21-18,11:41AM,Can We Finally Call Snap Stock a Lost Cause?
fb,Sep-21-18,11:15AM,"Pawar Law Group Announces a Securities Class Action Lawsuit Against Facebook, Inc. - FB"
fb,Sep-21-18,10:31AM,Investors Should Avoid Alphabet Until It Starts Doing One Thing
fb,Sep-21-18,10:00AM,Amazon Is Becoming the Third Largest Internet Ad Platform in the U.S.
fb,Sep-21-18,06:53AM,"Alphabet, Facebook and Netflix are about to destroy the stock market's biggest dividend trade"
fb,Sep-21-18,06:51AM,Major S&P tech sector re-organization to take effect Mond...
fb,Sep-21-18,06:01AM,ACLU Pushes Facebook a Little Further Down the Road Toward Regulation
fb,Sep-21-18,01:46AM,"Facebook launches its new dating app, but how many people will really want to use it?"
fb,Sep-21-18,01:36AM,Facebook to drop on-site support for political campaigns
fb,Sep-20-18,11:38PM,Shopify Stock Could Be on Its Way to Making New Highs
fb,Sep-20-18,10:30PM,"Facebook stretches southward, signing 2018s largest Silicon Valley lease"
fb,Sep-20-18,10:30PM,Developer wasted no time hooking fast-growing Facebook in the tech titans hometown
fb,Sep-20-18,09:57PM,Facebook to drop on-site support for political campaigns
fb,Sep-20-18,07:48PM,[$$] EU Demands Facebook Update Misleading Fine Print
fb,Sep-20-18,06:27PM,Facebook to Give Less Direct Support to Trump in 2020 Campaign
fb,Sep-20-18,05:03PM,There will soon be a new way to play FANG stocks
fb,Sep-20-18,04:15PM,Facebook adds two more buildings to Prineville data centers
fb,Sep-20-18,04:05PM,Closing Bell: LIVE MARKETS BLOG
fb,Sep-20-18,03:57PM,Has the Search for Internet Journalism Business Models Come to an End?
fb,Sep-20-18,02:49PM,"Facebook begins rollout of dating product, starting in Colombia"
fb,Sep-20-18,01:56PM,Should You Buy Roku Stock After Its Huge 175% Run-up?
fb,Sep-20-18,01:55PM,"Facebook expands fake election news fight, but falsehoods still rampant"
fb,Sep-20-18,01:43PM,Heres a clear case for owning dividend stocks instead of bonds
fb,Sep-20-18,01:31PM,Why Its Time to Unload Facebook Stock
fb,Sep-20-18,01:08PM,Britain preparing to set up internet regulator: Buzzfeed
fb,Sep-20-18,12:56PM,"Dont Buy the Dip, There Are Darker Days Ahead for Twitter Stock"
fb,Sep-20-18,12:14PM,"Facebook Stock Is a Strong Buy, Unless This Happens"
fb,Sep-20-18,10:58AM,"Ahead of Index Shuffle, Investors Flock to Communication Sector ETF"
fb,Sep-20-18,10:35AM,Investors Should Stop Unfriending Facebook Stock
fb,Sep-20-18,10:24AM,Facebook said to test new dating feature in Colombia with safeguards to prevent stalking
fb,Sep-20-18,09:56AM,"Company News For Sep 20, 2018"
fb,Sep-20-18,09:12AM,"[$$] Stocks to Watch: Comcast, Tilray, Facebook, Amazon.com, Bank of America, JPMorgan Chase, Red Hat, Darden Restaurants, Herman Miller"
fb,Sep-20-18,07:34AM,"Zacks Earnings Trends Highlights: Apple, Alphabet and Facebook"
fb,Sep-20-18,07:30AM,"Google, Facebook Lead Digitals March to Half of U.S. Ad Market"
fb,Sep-20-18,07:22AM,EU warns Facebook of fines for 'misleading' terms of service
fb,Sep-20-18,06:34AM,[$$] EU Demands Facebook Update 'Misleading' Fine Print
fb,Sep-20-18,06:24AM,Facebook and Twitter must comply with EU consumer rules or face sanctions
fb,Sep-20-18,04:22AM,EU says Facebook must comply with EU consumer rules by end-2018 or face sanctions
fb,Sep-20-18,01:00AM,Silicon Valley and Publishers Fight on After EU Copyright Vote
fb,Sep-19-18,09:00PM,eMarketer: Amazon Just Became the Third-Largest U.S. Digital Ad Platform
fb,Sep-19-18,08:38PM,"Facebook expands fake election news fight, but falsehoods still rampant"
fb,Sep-19-18,08:08PM,"Like Facebook, Apple Wants to Create a &quot;Trust Score&quot; About You"
fb,Sep-19-18,07:03PM,"Facebook expands fake election news fight, but falsehoods still rampant"
fb,Sep-19-18,06:35PM,Why Did Facebook (FB) Stock Climb Wednesday?
fb,Sep-19-18,05:54PM,Macy's partners with Facebook to bring virtual reality into its stores
fb,Sep-19-18,05:45PM,Facebook (FB) Outpaces Stock Market Gains: What You Should Know
fb,Sep-19-18,04:19PM,This Is Why the S&P 500 Will Rally Big Into the End of 2018
fb,Sep-19-18,04:04PM,Closing Bell: LIVE MARKETS BLOG
fb,Sep-19-18,04:02PM,5 Top Stock Trades for Thursday  Trading FANG Stocks and Tilray
fb,Sep-19-18,03:53PM,Lawsuit says Facebook lets employers exclude women in recruiting campaigns
fb,Sep-19-18,03:36PM,A Concern for Tech ETFs Despite QQQ Up 18% YTD?
fb,Sep-19-18,03:34PM,Should Google & Facebook Fear Amazon's Growing Ad Business?
fb,Sep-19-18,03:21PM,Not just tech: The stock-market rally is broader than its given credit for
fb,Sep-19-18,02:50PM,"Facebook yet to comply with EU consumer rules, Airbnb in line: EU sources"
fb,Sep-19-18,02:01PM,Facebook accused of discriminating against women with male-targeted job adverts
fb,Sep-19-18,10:56AM,"Amazon Gains Ad Market Share From Google, Facebook"
fb,Sep-19-18,10:45AM,Amazon's Ad Business Moves Up to Third in U.S. Market Share
fb,Sep-19-18,10:40AM,New Alexa Devices Can Power Amazon Stock  and Hurt Rivals
fb,Sep-19-18,10:24AM,Job postings suggest Facebook could be developing an in-house AR chip
fb,Sep-19-18,10:17AM,Amazon to become the third largest digital ad platform in the U.S.
fb,Sep-19-18,10:14AM,"These are the 10 most relevant brands to consumersFacebook, Twitter, Snapchat didn't make the list"
fb,Sep-19-18,09:19AM,"FINAL DEADLINE ALERT: Brower Piven Reminds Shareholders Of Approaching Deadline In Class Action Lawsuit And Encourages Those Who Have Losses In Excess Of $100,000 From Investment In Facebook, Inc. (Nasdaq: FB) To Contact The Firm"
fb,Sep-19-18,07:40AM,Amazon makes headway in breaking up Facebook and Google's digital ad duopoly
fb,Sep-19-18,06:00AM,"Amazon Increases Ad Market Share at Expense of Google, Facebook"
fb,Sep-18-18,08:20PM,[$$] Facebook and Financial Firms Tussled for Years Over Access to User Data
fb,Sep-18-18,08:20PM,[$$] Bertelsmann to Merge Unit That Moderates for Facebook With a Competitor
fb,Sep-18-18,07:12PM,Oregon using Facebook to remind inactive voters to register
fb,Sep-18-18,06:56PM,"The Law Offices of Howard G. Smith Reminds Investors of Looming Deadline in the Class Action Lawsuit Against Facebook, Inc. (FB)"
fb,Sep-18-18,06:47PM,Oregon using Facebook to remind inactive voters to register
fb,Sep-18-18,06:35PM,"The Law Offices of Howard G. Smith Reminds Investors of Looming Deadline in the Class Action Lawsuit Against Facebook, Inc. (FB)"
fb,Sep-18-18,05:43PM,Facebook accused of gender bias
fb,Sep-18-18,03:42PM,QAnon Is Trying to Trick Facebooks Meme-Reading AI
fb,Sep-18-18,03:14PM,Facebook accused of discriminating against women with targeted job adverts
fb,Sep-18-18,03:11PM,Here's Another Way Facebook Can Monetize Instagram
fb,Sep-18-18,03:07PM,The Decline of Facebook Stock Has Created a Good Buying Opportunity
fb,Sep-18-18,02:38PM,ACLU: Facebook allows gender-biased job ads on its platform
fb,Sep-18-18,02:36PM,Facebook Is JPMorgan's Most Controversial Company in Portfolio
fb,Sep-18-18,02:36PM,ACLU: Facebook allows gender-biased job ads on its platform
fb,Sep-18-18,02:05PM,Only One of These Media Stocks Is a Long-Term Buy on NFL Prospects
fb,Sep-18-18,02:00PM,ACLU Files Discrimination Complaint Against Facebook for Targeted Job Ads
fb,Sep-18-18,01:54PM,Investors Pour Money Into This ETF Ahead of Index Reorganization
fb,Sep-18-18,01:40PM,The Tesla of China & the Facebook-Macy's Connection | Free Lunch
fb,Sep-18-18,01:24PM,"Facebook Can't Settle One Ad Bias Claim, Gets Hit With Another"
fb,Sep-18-18,01:24PM,"Facebook Can't Settle an Ad Bias Claim, Draws New Complaint"
fb,Sep-18-18,01:00PM,"CLASS ACTION UPDATE for TSLA, RMTI and FB: Levi & Korsinsky, LLP Reminds Investors of Class Actions on Behalf of Shareholders"
fb,Sep-18-18,12:50PM,Facebook Is Facing a Legal Battle with ACLU & CWA
tsla,Jan-04-19,08:36PM,Why Tesla Stock Popped 6%
tsla,Jan-04-19,07:42PM,Tesla urges tariff exemption for Chinese-made car computer 'brain'
tsla,Jan-04-19,07:17PM,Tesla urges tariff exemption for Chinese-made car computer 'brain'
tsla,Jan-04-19,07:07PM,Tesla urges tariff exemption for Chinese-made car computer 'brain'
tsla,Jan-04-19,06:19PM,Elon Musk Isnt Keen on Investors Dragging Girlfriend Into Tweet Lawsuit
tsla,Jan-04-19,06:02PM,"CNBC Tech Check Evening Edition: January 04, 2019"
tsla,Jan-04-19,04:26PM,"Tesla Ready To Deliver Model 3 Vehicles To China, Europe"
tsla,Jan-04-19,04:06PM,"Stock Market Rally Extends On Fed Chairman Powell, Jobs; Apple, Tesla, Delta Disappoint; Bristol-Myers Buys Celgene: Weekly Review"
tsla,Jan-04-19,03:56PM,Buy Tesla (TSLA) Stock in 2019 on International Model 3 Expansion?
tsla,Jan-04-19,12:32PM,AT&T Stock Still Is One of the Best Downturn Plays
tsla,Jan-04-19,11:50AM,Tesla and GM Are Watching Their Federal Tax Credits Dwindle
tsla,Jan-04-19,11:48AM,Tesla to start delivering Model 3 to China buyers in March
tsla,Jan-04-19,11:46AM,Longtime Tesla Bear Still Expects A Sharp Valuation Plunge
tsla,Jan-04-19,11:07AM,Elon Musk wants to keep ex-girlfriend Grimes out of an investor lawsuit over his take-private tweet
tsla,Jan-04-19,10:16AM,Apples stock price wont recover and 9 more bold predictions for 2019
tsla,Jan-04-19,10:00AM,Tesla's biggest bear says stock will tank 70 percent in 2019
tsla,Jan-04-19,09:27AM,The Tesla Model Y will be unveiled this year  here are the latest updates
tsla,Jan-04-19,09:19AM,Tesla opens up Model 3 configuration to left-hand drive European countries
tsla,Jan-04-19,09:00AM,Musk Deletes Tweet Sharing Incorrect Report of Tesla Sales Win
tsla,Jan-04-19,08:55AM,Tesla's not-so-happy start to the new year
tsla,Jan-04-19,08:22AM,Truckin': Auto Sales Pivot Away From Cars In 2018
tsla,Jan-04-19,08:10AM,German annual car sales fall 0.2 percent as diesel bans dampen demand
tsla,Jan-04-19,08:09AM,German annual car sales fall 0.2 pct as diesel bans dampen demand
tsla,Jan-04-19,07:55AM,Tesla to Begin Model 3 Deliveries to China Customers in March
tsla,Jan-04-19,07:17AM,"Stocks making the biggest moves premarket: LUV, TSLA, NFLX, INTC & more"
tsla,Jan-04-19,07:08AM,"Jobs Report, Jerome Powell, Apple, Tesla, Trade Talks - 5 Things You Must Know"
tsla,Jan-04-19,07:00AM,Today's Research Reports on Trending Tickers: General Motors and Tesla
tsla,Jan-04-19,06:58AM,"Tesla delivery numbers reveal little about the future, unless you want them to"
tsla,Jan-04-19,12:01AM,Tesla Is Close to Model 3 Approval for Europe Sales
tsla,Jan-03-19,10:06PM,Tesla's Musk Says Singapore Government Has Been Unwelcoming
tsla,Jan-03-19,06:20PM,"Tesla stock drops over missed delivery estimates, price cuts"
tsla,Jan-03-19,05:44PM,Tesla Down Almost 10% in 2019 Despite Model 3 Cracking Top 5 in Sedan Sales
tsla,Jan-03-19,05:23PM,"Born with 'gasoline in his blood,' GM's Reuss adds president to long list of duties"
tsla,Jan-03-19,05:15PM,"SpaceX confirms its raising $500 million, still lists Steve Jurvetson as board member"
tsla,Jan-03-19,04:11PM,"Space Taxis, Air Taxis, Robotaxis Make 2019 A Pivotal Year In Mobility"
tsla,Jan-03-19,04:11PM,Heres What Analysts Said After Teslas Price Cut Announcement
tsla,Jan-03-19,04:09PM,"GM U.S. Sales Fall 2.7% In Q4; Ford, Fiat Chrysler Beat In December"
tsla,Jan-03-19,03:08PM,AP Explains: What Tesla price cuts mean for demand
tsla,Jan-03-19,03:05PM,Government shutdown may threaten SpaceXs unmanned Crew Dragon demo
tsla,Jan-03-19,02:50PM,"Analysts Tackle Tesla Price Cut, Demand Concerns"
tsla,Jan-03-19,11:42AM,What Is Artificial Intelligence? Examples and News in 2019
tsla,Jan-03-19,11:41AM,Detroit Auto Show will be 'all you can eat buffet of prof...
tsla,Jan-03-19,11:40AM,Could Tesla price cuts mean demand is slowing?
tsla,Jan-03-19,09:51AM,"Company News For Jan 3, 2019"
tsla,Jan-03-19,09:27AM,Tesla Stock Doomsayers Are Wrong About the Q4 Delivery Update
tsla,Jan-03-19,09:02AM,"Tesla (TSLA) Announces Q4 Deliveries, Slashes Price in the US"
tsla,Jan-03-19,08:41AM,"Auto Stock Roundup: Tesla Lowers Price, General Motors Reaches Tax Credit Phase Out Limit"
tsla,Jan-03-19,08:04AM,"3 Big Stock Charts for Thursday: Medtronic, Facebook and eBay"
tsla,Jan-03-19,04:24AM,Tesla Stock on a Blockchain Offers Hint of Where Crypto's Headed
tsla,Jan-03-19,01:36AM,"Tesla cuts U.S. prices on all vehicles, shares drop"
tsla,Jan-03-19,12:36AM,PRESS DIGEST -Wall Street Journal - Jan 3
tsla,Jan-02-19,10:50PM,"Tesla Shares Sink on Model 3 Delivery Miss, Price Cut"
tsla,Jan-02-19,08:06PM,Tesla: Growing Faster as It Gets Bigger?
tsla,Jan-02-19,07:52PM,"US STOCKS-Wall St ekes out gain, Apple cuts revenue forecast after the bell"
tsla,Jan-02-19,07:24PM,"Tesla Shares Sink on Model 3 Delivery Miss, Price Cuts"
tsla,Jan-02-19,06:59PM,Cut in federal tax credit poses 'risk' to Tesla: LMC Auto...
tsla,Jan-02-19,06:08PM,Why Tesla's electric slide could be a buying opportunity
tsla,Jan-02-19,05:59PM,Tesla's Unexpected Car Price Cut Sends Bonds Into the Tank
tsla,Jan-02-19,05:42PM,Why Tesla's electric slide could be a buying opportunity
tsla,Jan-02-19,05:32PM,"Tesla cuts U.S. prices on all vehicles, shares drop"
tsla,Jan-02-19,05:30PM,"US STOCKS-Wall St ekes out gains, Apple cuts revenue forecast after the bell"
tsla,Jan-02-19,04:35PM,"Why Tesla, MyoKardia, and Hologic Slumped Today"
tsla,Jan-02-19,04:21PM,Tesla Stock Falls As Model 3 Deliveries Fall Short In Fourth Quarter
tsla,Jan-02-19,04:20PM,Dow Ekes Out Gains as Oil Rally Lifts U.S. Stocks
tsla,Jan-02-19,04:19PM,Tesla shares fall after company missed delivery estimates
tsla,Jan-02-19,04:19PM,"3 Things to Know at Market Close: Netflix, Tesla and the Government Shutdown"
tsla,Jan-02-19,04:06PM,"U.S. Auto Sales, This Key Economic Gauge Are On Tap: Action Plan"
tsla,Jan-02-19,04:05PM,Teslas Price Cuts Raise Questions About Margins and Demand
tsla,Jan-02-19,04:05PM,Stocks end slightly higher to begin 2019 as Nasdaq bags five-day winning streak
tsla,Jan-02-19,04:04PM,GM Joins Tesla In Reaching This Key Threshold For Electric Car Sales
tsla,Jan-02-19,03:45PM,Tesla Wraps Up a Big Year With Record Deliveries
tsla,Jan-02-19,03:36PM,Model 3 Tracker Nails Teslas Exit From Production Hell
tsla,Jan-02-19,03:05PM,"Tesla stock tumbles after deliveries disappoint, price cuts announced"
tsla,Jan-02-19,01:54PM,Tesla's Deliveries Miss Spells More Pressure to Mass-Produce a Cheaper Model 3
tsla,Jan-02-19,01:51PM,Tesla to cut prices
tsla,Jan-02-19,01:32PM,Tesla Falls to Key Support After Deliveries Update
tsla,Jan-02-19,01:05PM,Tesla Cuts Prices as Model 3 Deliveries Miss Estimates
tsla,Jan-02-19,12:59PM,Elon Musk and Tim Cook use this simple but effective leadership tactic on Twitter
tsla,Jan-02-19,12:58PM,"GM sold 200,000 electric vehicles in U.S. by 2018, triggering tax-credit phaseout - source"
tsla,Jan-02-19,12:49PM,Tesla Sinks After Missing Fourth-Quarter Delivery Estimates and Cutting Prices
tsla,Jan-02-19,12:10PM,Stock Market News: Nasdaq Pares 1.9% Intraday Loss As Chip Stocks Lead
tsla,Jan-02-19,12:01PM,"Tesla shares drop on price cut, disappointing Model 3 deliveries"
tsla,Jan-02-19,11:59AM,Tesla's Numbers Come With Some Reservations
tsla,Jan-02-19,11:43AM,Tesla shares tumble after lackluster delivery numbers
tsla,Jan-02-19,11:03AM,"Tesla Shares Tumble After Release of Q4 Deliveries, Announces $2,000 Price Cut"
tsla,Jan-02-19,10:56AM,Obama's Favorite Business Books of 2018
tsla,Jan-02-19,10:36AM,Why Tesla Stock Was Slammed Wednesday
tsla,Jan-02-19,10:34AM,Strong U.S. Economy to Boost Wall Street in 2019
tsla,Jan-02-19,10:31AM,Tesla Sinks as Price Cuts Signal a Ceiling for Costly Models
tsla,Jan-02-19,10:25AM,Norway's electric cars zip to new record: almost a third of all sales
tsla,Jan-02-19,10:19AM,"Tesla stock plunges on weak year-end sales, surprise $2,000 price cut"
tsla,Jan-02-19,10:15AM,"Stocks Sell Off But Try To Recover; Apple, Netflix, Tesla Under Fire"
tsla,Jan-02-19,09:38AM,Stocks Dive As China Tariffs Bite; Dow Jones Drops 350 Points
tsla,Jan-02-19,09:33AM,Dow tumbles by more than 350 points at the open as China slowdown spooks Wall Street to start 2019
tsla,Jan-02-19,09:26AM,"Tesla's stock tumbles after deliveries miss, price cuts"
tsla,Jan-02-19,09:19AM,Norway's electric cars zip to new record: almost a third of all sales
tsla,Jan-02-19,09:13AM,"Tesla cuts prices on all models by $2,000 to offset reduction in federal tax credit"
tsla,Jan-02-19,09:08AM,"Tesla shares dive after price cut, production numbers"
tsla,Jan-02-19,08:56AM,"Hedge fund all-star David Einhorn posts his worst year ever, losing 34% in 2018"
tsla,Jan-02-19,08:47AM,"Tesla produced 61,394 Model 3s in fourth quarter"
tsla,Sep-21-18,09:56PM,Billionaire investor questions Elon Musk getting 'a pass' after bombshell tweets
tsla,Sep-21-18,09:30PM,Broadcoms Stock Looks Like a Winner
